A2: Supplementary Database 2. Small RNAs mapping to newly identified miRNA loci
A5: A tab-delimited text file of small RNA sequences in DNA form, with the indices of match to hairpins, can be accessed here.
A8: Each miRNA name is hyperlinked to an image (in GIF format) illustrating the predicted hairpin in DNA form. The miRNA sequence is rendered in red and the most abundant sequence on the opposite arm is in green. Nucleotides 5' of the miRNA are in black, nucleotides 3' of the miRNA are in blue. Also depicted is the abundance profile of reads at each position on the hairpin, given as the absolute count of reads whose 5'-most nucleotide is at the indicated position, and whose 3'-most nucleotide is at the indicated position. Datapoints above the axis represent sense reads, while those below the axis represent reads to the antisense strand.
A10: The "reads" link in the "Alignment" column is hyperlinked to alignments of all small RNA sequences to newly identified miRNA hairpins. The sequence of the miRNA hairpin is shown above its predicted secondary structure in bracket notation as determined by RNAFold. The alignment of the mature miRNA is illustrated in red below the structure depiction. This is followed by all matching small RNA sequences anchored to the hairpin sequence, along with the read frequency (Freq) and number of genomic hits (Hits) for each small RNA. Bracketed species represent small RNAs that mapped to the antisense strand of the locus.
A12: a Designations are as in Table 2
A13: b Number of reads; F= flower, R = rosette, Se = seedling, Si = silique
A14: c Specifies which arm of the foldback contains the mature miRNA sequence
A15: d Sequences matching hairpin; S = Sense, AS = Antisense
A16: e Degree of match to predicted mature miRNA sequences in Lu et al. (2005) (first column) or Lindow et al. (2005) (second column)
G20: Most abundant sequence (mature miRNA) | R20: Hairpind
U21: Overlap with previously predicted hairpinse
A22: miRNA family | B22: miRNA locus | C22: Alignment | D22: Sequence | E22: Length | F22: miRNA* a | G22: Fb | H22: Rb | I22: Seb | J22: Sib | K22: TOTAL | L22: Chromosome | M22: Start | N22: End | O22: Strand | P22: Armc | Q22: S reads | R22: S uniques | S22: AS reads | T22: AS uniques | U22: Lu et al. (2005) | V22: Lindow et al. (2005)
A23: miR391 | B23: MIR391(3') | C23: reads | D23: ACGGUAUCUCUCCUACGUAGC | E23: =LEN(D23) -> 21 | F23: yes | G23: 33 | H23: 215 | I23: 13 | J23: 53 | K23: 314 | L23: 5 | M23: 24310437 | N23: 24310457 | O23: + | P23: 3 | Q23: 713 | R23: 9 | S23: 1 | T23: 1 | U23: same 5' end | V23: 17nt overlap at 5' end
B24: MIR391(5') | C24: reads | D24: UUCGCAGGAGAGAUAGCGCCA | E24: =LEN(D24) -> 21 | F24: yes | G24: 12 | H24: 259 | I24: 1 | J24: 108 | K24: 380 | L24: 5 | M24: 24310386 | N24: 24310406 | O24: + | P24: 5 | Q24: 713 | R24: 9 | S24: 1 | T24: 1 | U24: same 5'end
A25: miR771 | B25: MIR771 | C25: reads | D25: UGAGCCUCUGUGGUAGCCCUCA | E25: =LEN(D25) -> 22 | F25: yes | G25: 109 | H25: 2 | I25: 0 | J25: 26 | K25: 137 | L25: 3 | M25: 19670359 | N25: 19670380 | O25: - | P25: 3 | Q25: 142 | R25: 6 | S25: 0 | T25: 0
A26: miR772 | B26: MIR772(5') | C26: reads | D26: UGUAUGUAUGGUCGAAGUAGG | E26: 21 | F26: yes* | G26: 7 | H26: 1 | I26: 1 | J26: 11 | K26: =SUM(G26:J26) -> 20 | L26: 1 | M26: 4182271 | N26: 4182291 | O26: - | P26: 5 | Q26: 61 | R26: 15 | S26: 0 | T26: 0
A27: miR775g | B27: MIR775 | C27: reads | D27: UUCGAUGUCUAGCAGUGCCA | E27: 20 | F27: yes** | G27: 97 | H27: 104 | I27: 29 | J27: 155 | K27: =SUM(G27:J27) -> 385 | L27: 1 | M27: 29427439 | N27: 29427458 | O27: + | P27: 3 | Q27: 639 | R27: 21 | S27: 0 | T27: 0
A28: miR777 | B28: MIR777 | C28: reads | D28: UACGCAUUGAGUUUCGUUGCUU | E28: =LEN(D28) -> 22 | F28: yes | G28: 0 | H28: 2 | I28: 6 | J28: 2 | K28: 10 | L28: 1 | M28: 26641746 | N28: 26641767 | O28: + | P28: 3 | Q28: 13 | R28: 3 | S28: 0 | T28: 0
A29: miR779 | B29: MIR779.2 | C29: reads | D29: UGAUUGGAAAUUUCGUUGACU | E29: =LEN(D29) -> 21 | F29: yes | G29: 0 | H29: 2 | I29: 17 | J29: 1 | K29: 20 | L29: 2 | M29: 9567946 | N29: 9567966 | O29: + | P29: 3 | Q29: 32 | R29: 6 | S29: 0 | T29: 0
A30: miR822 | B30: MIR822 | C30: reads | D30: UGCGGGAAGCAUUUGCACAUG | E30: =LEN(D30) -> 21 | F30: yes | G30: 81 | H30: 26 | I30: 922 | J30: 34 | K30: 1063 | L30: 5 | M30: 897286 | N30: 897306 | O30: - | P30: 5 | Q30: 1890 | R30: 68 | S30: 2 | T30: 1 | U30: same 5' end
A31: miR823 | B31: MIR823 | C31: reads | D31: UGGGUGGUGAUCAUAUAAGAU | E31: =LEN(D31) -> 21 | F31: no | G31: 78 | H31: 14 | I31: 305 | J31: 296 | K31: 693 | L31: 3 | M31: 4496833 | N31: 4496853 | O31: - | P31: 3 | Q31: 702 | R31: 7 | S31: 0 | T31: 0 | V31: 19 nt overlap at 3' end
A32: miR824 | B32: MIR824 | C32: reads | D32: UAGACCAUUUGUGAGAAGGGA | E32: 21 | F32: yes | G32: 254 | H32: 33 | I32: 46 | J32: 90 | K32: 423 | L32: 4 | M32: 12625138 | N32: 12625158 | O32: + | P32: 5 | Q32: 793 | R32: 11 | S32: 0 | T32: 0
A33: miR825 | B33: MIR825 | C33: reads | D33: UUCUCAAGAAGGUGCAUGAAC | E33: =LEN(D33) -> 21 | F33: yes | G33: 1 | H33: 134 | I33: 13 | J33: 57 | K33: 205 | L33: 2 | M33: 11166852 | N33: 11166872 | O33: + | P33: 3 | Q33: 238 | R33: 4 | S33: 1 | T33: 1
A34: miR826 | B34: MIR826 | C34: reads | D34: UAGUCCGGUUUUGGAUACGUG | E34: =LEN(D34) -> 21 | F34: yes | G34: 16 | H34: 0 | I34: 0 | J34: 23 | K34: 39 | L34: 4 | M34: 1340528 | N34: 1340548 | O34: + | P34: 5 | Q34: 40 | R34: 2 | S34: 1 | T34: 1
A35: miR827 | B35: MIR827 | C35: reads | D35: UUAGAUGACCAUCAACAAACU | E35: =LEN(D35) -> 21 | F35: yes | G35: 2 | H35: 8 | I35: 0 | J35: 14 | K35: 24 | L35: 3 | M35: 22133788 | N35: 22133808 | O35: - | P35: 3 | Q35: 26 | R35: 3 | S35: 0 | T35: 0
A36: miR828 | B36: MIR828 | C36: reads | D36: UCUUGCUUAAAUGAGUAUUCCA | E36: =LEN(D36) -> 22 | F36: yes | G36: 0 | H36: 0 | I36: 1 | J36: 14 | K36: 15 | L36: 4 | M36: 13847026 | N36: 13847047 | O36: + | P36: 5 | Q36: 16 | R36: 2 | S36: 0 | T36: 0
A37: miR829 | B37: MIR829.1 | C37: reads | D37: CAAAUUAAAGCUUCAAGGUAG | E37: =LEN(D37) -> 21 | F37: yes | G37: 1 | H37: 0 | I37: 11 | J37: 0 | K37: 12 | L37: 1 | M37: 11834053 | N37: 11834073 | O37: - | P37: 3 | Q37: 31 | R37: 4 | S37: 0 | T37: 0
B38: MIR829.2 | C38: reads | D38: AGCUCUGAUACCAAAUGAUGGAAU | E38: =LEN(D38) -> 24 | F38: no | G38: 4 | H38: 1 | I38: 10 | J38: 0 | K38: 15 | L38: 1 | M38: 11834074 | N38: 11834097 | O38: - | P38: 3 | Q38: 31 | R38: 4 | S38: 0 | T38: 0
A39: miR830 | B39: MIR830 | C39: reads | D39: UAACUAUUUUGAGAAGAAGUG | E39: =LEN(D39) -> 21 | F39: yes | G39: 5 | H39: 1 | I39: 0 | J39: 3 | K39: 9 | L39: 1 | M39: 4820403 | N39: 4820423 | O39: - | P39: 3 | Q39: 19 | R39: 6 | S39: 0 | T39: 0
A40: miR831 | B40: MIR831 | C40: reads | D40: UGAUCUCUUCGUACUCUUCUUG | E40: =LEN(D40) -> 22 | F40: yes | G40: 0 | H40: 0 | I40: 1 | J40: 5 | K40: 6 | L40: 2 | M40: 10254470 | N40: 10254491 | O40: + | P40: 3 | Q40: 10 | R40: 4 | S40: 0 | T40: 0
A41: miR832 | B41: MIR832(3') | C41: reads | D41: UUGAUUCCCAAUCCAAGCAAG | E41: =LEN(D41) -> 21 | F41: yes | G41: 0 | H41: 0 | I41: 0 | J41: 3 | K41: 3 | L41: 4 | M41: 6413271 | N41: 6413291 | O41: + | P41: 3 | Q41: 11 | R41: 4 | S41: 0 | T41: 0
B42: MIR832(5') | C42: reads | D42: UGCUGGGAUCGGGAAUCGAAA | E42: =LEN(D42) -> 21 | F42: yes | G42: 0 | H42: 0 | I42: 0 | J42: 6 | K42: 6 | L42: 4 | M42: 6413055 | N42: 6413075 | O42: + | P42: 5 | Q42: 11 | R42: 4 | S42: 0 | T42: 0
A43: miR833 | B43: MIR833(3') | C43: reads | D43: UAGACCGAUGUCAACAAACAAG | E43: =LEN(D43) -> 22 | F43: yes | G43: 2 | H43: 0 | I43: 1 | J43: 4 | K43: 7 | L43: 1 | M43: 29530158 | N43: 29530179 | O43: + | P43: 3 | Q43: 21 | R43: 9 | S43: 2 | T43: 2
B44: MIR833(5') | C44: reads | D44: UGUUUGUUGUACUCGGUCUAGU | E44: =LEN(D44) -> 22 | F44: yes | G44: 0 | H44: 2 | I44: 1 | J44: 2 | K44: 5 | L44: 1 | M44: 29530097 | N44: 29530118 | O44: + | P44: 5 | Q44: 21 | R44: 9 | S44: 2 | T44: 2 | V44: 7 nt overlap at 3' end
A45: miR834 | B45: MIR834 | C45: reads | D45: UGGUAGCAGUAGCGGUGGUAA | E45: =LEN(D45) -> 21 | F45: yes | G45: 2 | H45: 0 | I45: 0 | J45: 1 | K45: 3 | L45: 5 | M45: 2641478 | N45: 2641498 | O45: - | P45: 3 | Q45: 4 | R45: 2 | S45: 0 | T45: 0
A46: miR835 | B46: MIR835(3') | C46: reads | D46: UGGAGAAGAUACGCAAGAAAG | E46: =LEN(D46) -> 21 | F46: yes | G46: 0 | H46: 0 | I46: 1 | J46: 1 | K46: 2 | L46: 1 | M46: 28549365 | N46: 28549385 | O46: - | P46: 3 | Q46: 8 | R46: 6 | S46: 0 | T46: 0
B47: MIR835(5') | C47: reads | D47: UUCUUGCAUAUGUUCUUUAUC | E47: =LEN(D47) -> 21 | F47: yes | G47: 2 | H47: 0 | I47: 0 | J47: 0 | K47: 2 | L47: 1 | M47: 28549678 | N47: 28549698 | O47: - | P47: 5 | Q47: 8 | R47: 6 | S47: 1 | T47: 1
A48: miR836 | B48: MIR836 | C48: reads | D48: UCCUGUGUUUCCUUUGAUGCGUGG | E48: =LEN(D48) -> 24 | F48: yes | G48: 0 | H48: 0 | I48: 0 | J48: 2 | K48: 2 | L48: 2 | M48: 10641410 | N48: 10641433 | O48: - | P48: 3 | Q48: 3 | R48: 2 | S48: 0 | T48: 0
A49: miR837 | B49: MIR837(3') | C49: reads | D49: AAACGAACAAAAAACUGAUGG | E49: =LEN(D49) -> 21 | F49: yes | G49: 0 | H49: 0 | I49: 1 | J49: 2 | K49: 3 | L49: 1 | M49: 6521044 | N49: 6521064 | O49: + | P49: 3 | Q49: 8 | R49: 5 | S49: 0 | T49: 0
B50: MIR837(5') | C50: reads | D50: AUCAGUUUCUUGUUCGUUUCA | E50: =LEN(D50) -> 21 | F50: yes | G50: 0 | H50: 1 | I50: 1 | J50: 0 | K50: 2 | L50: 1 | M50: 6520986 | N50: 6521006 | O50: + | P50: 5 | Q50: 8 | R50: 5 | S50: 0 | T50: 0
A51: miR838 | B51: MIR838 | C51: reads | D51: UUUUCUUCUACUUCUUGCACA | E51: =LEN(D51) -> 21 | F51: yes | G51: 0 | H51: 1 | I51: 0 | J51: 1 | K51: 2 | L51: 1 | M51: 28635 | N51: 28655 | O51: + | P51: 3 | Q51: 3 | R51: 2 | S51: 0 | T51: 0
A52: miR839 | B52: MIR839 | C52: reads | D52: UACCAACCUUUCAUCGUUCCC | E52: =LEN(D52) -> 21 | F52: yes* | G52: 184 | H52: 7 | I52: 39 | J52: 4 | K52: 234 | L52: 1 | M52: 25282801 | N52: 25282821 | O52: - | P52: 5 | Q52: 331 | R52: 27 | S52: 1 | T52: 1 | U52: same 5' end
A53: miR840 | B53: MIR840 | C53: reads | D53: ACACUGAAGGACCUAAACUAAC | E53: =LEN(D53) -> 22 | F53: yes* | G53: 3 | H53: 22 | I53: 4 | J53: 17 | K53: 46 | L53: 2 | M53: 771491 | N53: 771512 | O53: - | P53: 5 | Q53: 116 | R53: 11 | S53: 0 | T53: 0
A54: miR841 | B54: MIR841 | C54: reads | D54: UACGAGCCACUUGAAACUGAA | E54: =LEN(D54) -> 21 | F54: yes* | G54: 0 | H54: 13 | I54: 2 | J54: 9 | K54: 24 | L54: 4 | M54: 7885389 | N54: 7885409 | O54: - | P54: 5 | Q54: 88 | R54: 17 | S54: 0 | T54: 0
A55: miR842 | B55: MIR842 | C55: reads | D55: UCAUGGUCAGAUCCGUCAUCC | E55: =LEN(D55) -> 21 | F55: yes* | G55: 0 | H55: 0 | I55: 14 | J55: 0 | K55: 14 | L55: 1 | M55: 22580859 | N55: 22580879 | O55: + | P55: 3 | Q55: 27 | R55: 5 | S55: 0 | T55: 0 | U55: same 5' end | V55: 15 nt overlap at 3' end
A56: miR843 | B56: MIR843 | C56: reads | D56: UUUAGGUCGAGCUUCAUUGGA | E56: =LEN(D56) -> 21 | F56: yes* | G56: 0 | H56: 4 | I56: 1 | J56: 2 | K56: 7 | L56: 3 | M56: 17753132 | N56: 17753152 | O56: + | P56: 5 | Q56: 18 | R56: 8 | S56: 0 | T56: 0 | V56: 19 nt overlap at 3' end
A57: miR844 | B57: MIR844(3') | C57: reads | D57: UUAUAAGCCAUCUUACUAGUU | E57: =LEN(D57) -> 21 | F57: yes* | G57: 0 | H57: 2 | I57: 3 | J57: 3 | K57: 8 | L57: 2 | M57: 9949282 | N57: 9949302 | O57: - | P57: 3 | Q57: 26 | R57: 8 | S57: 0 | T57: 0
B58: MIR844(5') | C58: reads | D58: UGGUAAGAUUGCUUAUAAGCU | E58: =LEN(D58) -> 21 | F58: yes* | G58: 0 | H58: 0 | I58: 4 | J58: 1 | K58: 5 | L58: 2 | M58: 9949341 | N58: 9949361 | O58: - | P58: 5 | Q58: 26 | R58: 8 | S58: 0 | T58: 0
A59: miR845 | B59: MIR845 | C59: reads | D59: CGGCUCUGAUACCAAUUGAUG | E59: =LEN(D59) -> 21 | F59: yes** | G59: 153 | H59: 4 | I59: 142 | J59: 104 | K59: 403 | L59: 4 | M59: 12217467 | N59: 12217487 | O59: - | P59: 3 | Q59: 407 | R59: 2 | S59: 0 | T59: 0
A60: miR846 | B60: MIR846 | C60: reads | D60: UUGAAUUGAAGUGCUUGAAUU | E60: =LEN(D60) -> 21 | F60: yes** | G60: 0 | H60: 51 | I60: 26 | J60: 21 | K60: 98 | L60: 1 | M60: 22581327 | N60: 22581347 | O60: + | P60: 3 | Q60: 165 | R60: 17 | S60: 0 | T60: 0
A61: miR847 | B61: MIR847 | C61: reads | D61: UCACUCCUCUUCUUCUUGAUG | E61: 21 | F61: yes** | G61: 45 | H61: 2 | I61: 2 | J61: 5 | K61: =SUM(G61:J61) -> 54 | L61: 1 | M61: 2165674 | N61: 2165694 | O61: + | P61: 3 | Q61: 58 | R61: 4 | S61: 4 | T61: 2
A62: miR848 | B62: MIR848 | C62: reads | D62: UGACAUGGGACUGCCUAAGCUA | E62: =LEN(D62) -> 22 | F62: yes** | G62: 2 | H62: 22 | I62: 16 | J62: 11 | K62: 51 | L62: 5 | M62: 4479450 | N62: 4479471 | O62: - | P62: 3 | Q62: 63 | R62: 6 | S62: 1 | T62: 1
A63: miR849 | B63: MIR849 | C63: reads | D63: UAACUAAACAUUGGUGUAGUA | E63: =LEN(D63) -> 21 | F63: yes** | G63: 0 | H63: 0 | I63: 12 | J63: 4 | K63: 16 | L63: 3 | M63: 16083487 | N63: 16083507 | O63: - | P63: 3 | Q63: 17 | R63: 2 | S63: 0 | T63: 0
A64: miR850 | B64: MIR850 | C64: reads | D64: UAAGAUCCGGACUACAACAAAG | E64: =LEN(D64) -> 22 | F64: yes** | G64: 0 | H64: 5 | I64: 1 | J64: 9 | K64: 15 | L64: 4 | M64: 7845752 | N64: 7845773 | O64: + | P64: 5 | Q64: 25 | R64: 7 | S64: 0 | T64: 0
A65: miR851 | B65: MIR851(3') | C65: reads | D65: UGGGUGGCAAACAAAGACGAC | E65: =LEN(D65) -> 21 | F65: yes** | G65: 5 | H65: 0 | I65: 0 | J65: 4 | K65: 9 | L65: 3 | M65: 19670555 | N65: 19670575 | O65: - | P65: 3 | Q65: 22 | R65: 3 | S65: 0 | T65: 0
B66: MIR851(5') | C66: reads | D66: UCUCGGUUCGCGAUCCACAAG | E66: =LEN(D66) -> 21 | F66: yes** | G66: 9 | H66: 1 | I66: 0 | J66: 2 | K66: 12 | L66: 3 | M66: 19670624 | N66: 19670644 | O66: - | P66: 5 | Q66: 22 | R66: 3 | S66: 0 | T66: 0 | U66: same 5' end
A67: miR852 | B67: MIR852 | C67: reads | D67: AAGAUAAGCGCCUUAGUUCUG | E67: =LEN(D67) -> 21 | F67: yes** | G67: 0 | H67: 2 | I67: 2 | J67: 0 | K67: 4 | L67: 4 | M67: 8336298 | N67: 8336318 | O67: + | P67: 3 | Q67: 11 | R67: 5 | S67: 0 | T67: 0
A68: miR853 | B68: MIR853 | C68: reads | D68: UCCCCUCUUUAGCUUGGAGAAG | E68: =LEN(D68) -> 22 | F68: yes** | G68: 0 | H68: 0 | I68: 2 | J68: 1 | K68: 3 | L68: 3 | M68: 8346423 | N68: 8346444 | O68: + | P68: 5 | Q68: 5 | R68: 3 | S68: 0 | T68: 0
B69: CandidateA | C69: reads | D69: UAAUCCUACCAAUAACUUCAGC | E69: =LEN(D69) -> 22 | F69: no | G69: 52 | H69: 1 | I69: 0 | J69: 0 | K69: 53 | L69: 1 | M69: 11957467 | N69: 11957488 | O69: + | P69: 5 | Q69: 58 | R69: 4 | S69: 0 | T69: 0
B70: CandidateB | C70: reads | D70: UAGUAACAGAAUUUGGUGUUA | E70: =LEN(D70) -> 21 | F70: no | G70: 0 | H70: 0 | I70: 0 | J70: 40 | K70: 40 | L70: 4 | M70: 11233793 | N70: 11233813 | O70: - | P70: 5 | Q70: 46 | R70: 4 | S70: 0 | T70: 0 | V70: 18 nt overlap at 5' end
B71: CandidateC | C71: reads | D71: UGAGAUGAAAUCUUUGAUUGG | E71: =LEN(D71) -> 21 | F71: no | G71: 17 | H71: 0 | I71: 8 | J71: 6 | K71: 31 | L71: 2 | M71: 15618961 | N71: 15618981 | O71: + | P71: 5 | Q71: 33 | R71: 3 | S71: 0 | T71: 0
B72: CandidateD | C72: reads | D72: UUCGUUGUCUGUUCGACCUUG | E72: 21 | F72: no | G72: 4 | H72: 0 | I72: 16 | J72: 6 | K72: =SUM(G72:J72) -> 26 | L72: 1 | M72: 26777356 | N72: 26777376 | O72: - | P72: 5 | Q72: 48 | R72: 11 | S72: 0 | T72: 0