A2: Supplementary Database 1. Small RNAs mapping to previously annotated miRNA loci
A4: This file contains updates to the "Previously annotated miRBase sequence" columns and the "Revised sequence" column. It only includes information on the previously annotated sequence if that sequence differs from the most abundant uniquely-mapping miRNA sequence in the dataset. It only includes a revised sequence if the most abundant sequence agrees with data on 5' RACE-verified targets for the miRNA in the literature, or if no RACE data has been reported for the miRNA's targets. The revised sequences have been submitted to miRBase.
A7: A tab-delimited text file of small RNA sequences in DNA form, with the indices of match to hairpins, can be accessed here.
A10: Each miRNA locus listed in blue was represented by reads in the dataset and is hyperlinked to an image (in GIF format) illustrating the predicted hairpin deriving from that locus in DNA form. The miRNA sequence is rendered in red and the most abundant sequence on the opposite arm is in green. Nucleotides 5' of the miRNA are in black, nucleotides 3' of the miRNA are in blue. Also depicted is the abundance profile of reads at each position on the hairpin, given as the absolute count of reads whose 5'-most nucleotide is at the indicated position, and whose 3'-most nucleotide is at the indicated position. Datapoints above the axis represent sense reads, while those below the axis represent reads to the antisense strand.
A12: The "reads" link in the "Alignment" column is hyperlinked to alignments of all small RNA sequences to previously annotated miRNA hairpins. The sequence of the miRNA hairpin is shown above its predicted secondary structure in bracket notation as determined by RNAFold. The alignment of the annotated mature miRNA is illustrated in red below the structure depiction. This is followed by all matching small RNA sequences anchored to the hairpin sequence, along with the read frequency (Freq) and number of genomic hits (Hits) for each small RNA. Bracketed species represent small RNAs that mapped to the antisense strand of the locus.
A14: Sequence of the most abundant miRNA variant mapping to the hairpin is given in bold black text.
A15: F = flower, R = rosette, Se = seedling, Si = silique. S = Sense, AS = Antisense
U16: Previously annotated miRBase sequence | AD16: Hairpin
A17: miRNA family | B17: miRNA locus | C17: Alignment | D17: 5' Sequence | E17: Length | F17: F | G17: R | H17: Se | I17: Si | J17: TOTAL | L17: 3' Sequence | M17: Length | N17: F | O17: R | P17: Se | Q17: Si | R17: TOTAL | U17: miRBase 7.1 Sequence | V17: Length | W17: F | X17: R | Y17: Se | Z17: Si | AA17: TOTAL | AB17: Revised Sequencea | AC17: Reads(S) | AD17: Uniques(S) | AE17: Reads(AS) | AF17: Uniques(AS) | AG17: miRNA Reads | AH17: miRNA* Reads
A18: miR156/157 | B18: ath-MIR156a | C18: reads | D18: UGACAGAAGAGAGUGAGCAC | E18: 20 | F18: 220 | G18: 236 | H18: 5676 | I18: 520 | J18: 6652 | L18: GCUCACUGCUCUUUCUGUCAGA | M18: 22 | N18: 0 | O18: 0 | P18: 31 | Q18: 1 | R18: 32 | AC18: 6880 | AD18: 20 | AE18: 1 | AF18: 1
B19: ath-MIR156b | C19: reads | D19: UGACAGAAGAGAGUGAGCAC | E19: 20 | F19: 220 | G19: 236 | H19: 5676 | I19: 520 | J19: 6652 | L19: UGCUCACCUCUCUUUCUGUCAGU | M19: 23 | N19: 49 | O19: 10 | P19: 109 | Q19: 6 | R19: 174 | AC19: 7026 | AD19: 19 | AE19: 1 | AF19: 1
B20: ath-MIR156c | C20: reads | D20: UGACAGAAGAGAGUGAGCAC | E20: 20 | F20: 220 | G20: 236 | H20: 5676 | I20: 520 | J20: 6652 | L20: GCUCACUGCUCUAUCUGUCAGA | M20: 22 | N20: 1 | O20: 0 | P20: 38 | Q20: 3 | R20: 42 | AC20: 6892 | AD20: 17 | AE20: 1 | AF20: 1
B21: ath-MIR156d | C21: reads | D21: UGACAGAAGAGAGUGAGCAC | E21: 20 | F21: 220 | G21: 236 | H21: 5676 | I21: 520 | J21: 6652 | L21: GCUCACUCUCUUUUUGUCAUAAC | M21: 23 | N21: 14 | O21: 7 | P21: 10 | Q21: 9 | R21: 40 | AC21: 6998 | AD21: 15 | AE21: 2 | AF21: 2
B22: ath-MIR156e | C22: reads | D22: UGACAGAAGAGAGUGAGCAC | E22: 20 | F22: 220 | G22: 236 | H22: 5676 | I22: 520 | J22: 6652 | L22: GCUUACUCUCUCUCUGUCACC | M22: 21 | N22: 0 | O22: 0 | P22: 13 | Q22: 1 | R22: 14 | AC22: 6818 | AD22: 10 | AE22: 1 | AF22: 1
B23: ath-MIR156f | C23: reads | D23: UGACAGAAGAGAGUGAGCAC | E23: 20 | F23: 220 | G23: 236 | H23: 5676 | I23: 520 | J23: 6652 | L23: GCUCACUCUCUAUCCGUCACC | M23: 21 | N23: 2 | O23: 0 | P23: 21 | Q23: 0 | R23: 23 | AC23: 6828 | AD23: 11 | AE23: 1 | AF23: 1
B24: ath-MIR156g | C24: reads | D24: CGACAGAAGAGAGUGAGCAC | E24: 20 | F24: 2 | G24: 0 | H24: 37 | I24: 4 | J24: 43 | L24: none | U24: CGACAGAAGAGAGUGAGCACA | V24: 21 | W24: 0 | X24: 0 | Y24: 1 | Z24: 0 | AA24: 1 | AB24: CGACAGAAGAGAGUGAGCAC | AC24: 53 | AD24: 5 | AE24: 1 | AF24: 1
B25: ath-MIR156h | C25: reads | D25: UGACAGAAGAAAGAGAGCAC | E25: 20 | F25: 8 | G25: 0 | H25: 0 | I25: 29 | J25: 37 | L25: GCUCUCUUUCCUUCUGCCACC | M25: 21 | N25: 1 | O25: 0 | P25: 0 | Q25: 5 | R25: 6 | U25: UUGACAGAAGAAAGAGAGCAC | V25: 21 | W25: 9 | X25: 0 | Y25: 0 | Z25: 14 | AA25: 23 | AB25: UGACAGAAGAAAGAGAGCAC | AC25: 66 | AD25: 3 | AE25: 0 | AF25: 0 | AG25: =SUM(J23:J25) -> 6732 | AH25: =SUM(R18:R25) -> 331
A26: miR156/157 | B26: ath-MIR157a | C26: reads | D26: UUGACAGAAGAUAGAGAGCAC | E26: 21 | F26: 9 | G26: 73 | H26: 546 | I26: 21 | J26: 649 | L26: GCUCUCUAGCCUUCUGUCAUC | M26: 21 | N26: 2 | O26: 13 | P26: 77 | Q26: 6 | R26: 98 | AC26: 877 | AD26: 13 | AE26: 0 | AF26: 0
B27: ath-MIR157b | C27: reads | D27: UUGACAGAAGAUAGAGAGCAC | E27: 21 | F27: 9 | G27: 73 | H27: 546 | I27: 21 | J27: 649 | L27: GCUCUCUAGCCUUCUGUCAUC | M27: 21 | N27: 2 | O27: 13 | P27: 77 | Q27: 6 | R27: 98 | AC27: 878 | AD27: 14 | AE27: 0 | AF27: 0
B28: ath-MIR157c | C28: reads | D28: UUGACAGAAGAUAGAGAGCAC | E28: 21 | F28: 9 | G28: 73 | H28: 546 | I28: 21 | J28: 649 | L28: GCUCUCUAUACUUCUGUCACC | M28: 21 | N28: 8 | O28: 9 | P28: 116 | Q28: 3 | R28: 136 | AC28: 945 | AD28: 15 | AE28: 1 | AF28: 1
B29: ath-MIR157d | C29: reads | D29: UGACAGAAGAUAGAGAGCAC | E29: 20 | F29: 10 | G29: 2 | H29: 68 | I29: 2 | J29: 82 | L29: GCUCUCUAUGCUUCUGUCAUCA | M29: 22 | N29: 8 | O29: 0 | P29: 0 | Q29: 0 | R29: 8 | AC29: 108 | AD29: 7 | AE29: 1 | AF29: 1 | AG29: =SUM(J26,J29) -> 731 | AH29: =SUM(R27:R29) -> 242
A30: miR158 | B30: ath-MIR158a | C30: reads | D30: CUUUGUCUACAAUUUUGGAAA | E30: 21 | F30: 7 | G30: 21 | H30: 6 | I30: 21 | J30: 55 | L30: UCCCAAAUGUAGACAAAGCA | M30: 20 | N30: 512 | O30: 106 | P30: 1443 | Q30: 662 | R30: 2723 | AC30: 3145 | AD30: 21 | AE30: 0 | AF30: 0
B31: ath-MIR158b | C31: reads | D31: CUUUGUCUACACUUUUGGAAA | E31: 21 | F31: 0 | G31: 0 | H31: 0 | I31: 1 | J31: 1 | L31: CCCAAAUGUAGACAAAGCA | M31: 19 | N31: 7 | O31: 0 | P31: 5 | Q31: 4 | R31: 16 | AC31: 44 | AD31: 8 | AE31: 0 | AF31: 0 | AG31: =SUM(R30, R31) -> 2739 | AH31: =SUM(J30,J31) -> 56
A32: miR159/319 | B32: ath-MIR159a | C32: reads | D32: AGCUGCUAAGCUAUGGAUCCC | E32: 21 | F32: 4 | G32: 0 | H32: 6 | I32: 3 | J32: 13 | L32: UUUGGAUUGAAGGGAGCUCUA | M32: 21 | N32: 221 | O32: 4046 | P32: 560 | Q32: 1794 | R32: 6621 | AC32: 6742 | AD32: 24 | AE32: 0 | AF32: 0
B33: ath-MIR159b | C33: reads | D33: AGCUGCUAAGCUAUGGAUCCC | E33: 21 | F33: 4 | G33: 0 | H33: 6 | I33: 3 | J33: 13 | L33: UUUGGAUUGAAGGGAGCUCUU | M33: 21 | N33: 17 | O33: 640 | P33: 53 | Q33: 272 | R33: 982 | AC33: 1066 | AD33: 21 | AE33: 0 | AF33: 0
B34: ath-MIR159c | C34: reads | D34: AGCUCCCUUCCUCCAAAACG | E34: 20 | F34: 0 | G34: 0 | H34: 0 | I34: 1 | J34: 1 | L34: UUUGGAUUGAAGGGAGCU | M34: 18 | N34: 1 | O34: 3 | P34: 5 | Q34: 2 | R34: 11 | AC34: 18 | AD34: 5 | AE34: 0 | AF34: 0 | AG34: =SUM(R32:R33) -> 7603 | AH34: =SUM(J33,J34) -> 14
A35: miR160 | B35: ath-MIR160a | C35: reads | D35: UGCCUGGCUCCCUGUAUGCCA | E35: 21 | F35: 1188 | G35: 608 | H35: 2872 | I35: 1223 | J35: 5891 | L35: GCGUAUGAGGAGCCAUGCAUA | M35: 21 | N35: 77 | O35: 144 | P35: 171 | Q35: 67 | R35: 459 | AC35: 6454 | AD35: 17 | AE35: 0 | AF35: 0
B36: ath-MIR160b | C36: reads | D36: UGCCUGGCUCCCUGUAUGCCA | E36: 21 | F36: 1188 | G36: 608 | H36: 2872 | I36: 1223 | J36: 5891 | L36: GCGUACAGAGUAGUCAAGCAUG | M36: 22 | N36: 3 | O36: 0 | P36: 6 | Q36: 0 | R36: 9 | AC36: 5974 | AD36: 15 | AE36: 0 | AF36: 0
B37: ath-MIR160c | C37: reads | D37: UGCCUGGCUCCCUGUAUGCCA | E37: 21 | F37: 1188 | G37: 608 | H37: 2872 | I37: 1223 | J37: 5891 | L37: GCGUACAAGGAGUCAAGCAUG | M37: 21 | N37: 8 | O37: 11 | P37: 23 | Q37: 7 | R37: 49 | AC37: 6094 | AD37: 21 | AE37: 0 | AF37: 0 | AG37: =J36 -> 5891 | AH37: =SUM(R35:R37) -> 517
A38: miR161 | B38: ath-MIR161 | C38: reads | D38: UGAAAGUGACUACAUCGGGGU | E38: 21 | F38: 835 | G38: 4593 | H38: 2714 | I38: 2431 | J38: 10573 | L38: CCUGGUUUAGUCACUUUCACU | M38: 21 | N38: 8 | O38: 7 | P38: 34 | Q38: 2 | R38: 51 | U38: UUGAAAGUGACUACAUCGGGG | V38: 21 | W38: 472 | X38: 980 | Y38: 659 | Z38: 727 | AA38: 2838 | AB38: UGAAAGUGACUACAUCGGGGU | AC38: 19921 | AD38: 46 | AE38: 0 | AF38: 0 | AG38: =J38 -> 10573 | AH38: =R38 -> 51
A39: miR162 | B39: ath-MIR162a | C39: reads | D39: GGAGGCAGCGGUUCAUCGAUC | E39: 21 | F39: 24 | G39: 0 | H39: 26 | I39: 9 | J39: 59 | L39: UCGAUAAACCUCUGCAUCCAG | M39: 21 | N39: 253 | O39: 70 | P39: 415 | Q39: 81 | R39: 819 | AC39: 965 | AD39: 13 | AE39: 2 | AF39: 1
B40: ath-MIR162b | C40: reads | D40: GGAGGCAGCGGUUCAUCGAUC | E40: 21 | F40: 24 | G40: 0 | H40: 26 | I40: 9 | J40: 59 | L40: UCGAUAAACCUCUGCAUCCAG | M40: 21 | N40: 253 | O40: 70 | P40: 415 | Q40: 81 | R40: 819 | AC40: 975 | AD40: 15 | AE40: 2 | AF40: 1 | AG40: =R39 -> 819 | AH40: =J39 -> 59
A41: miR163 | B41: ath-MIR163 | C41: reads | D41: UCGAGUUCCAACCUCUUCAAC | E41: 21 | F41: 12 | G41: 1 | H41: 14 | I41: 6 | J41: 33 | L41: UUGAAGAGGACUUGGAACUUCGAU | M41: 24 | N41: 156 | O41: 96 | P41: 241 | Q41: 119 | R41: 612 | AC41: 730 | AD41: 15 | AE41: 1 | AF41: 1 | AG41: =R41 -> 612 | AH41: =J41 -> 33
A42: miR164 | B42: ath-MIR164a | C42: reads | D42: UGGAGAAGCAGGGCACGUGCA | E42: 21 | F42: 1336 | G42: 1015 | H42: 1526 | I42: 2980 | J42: 6857 | L42: CACGUACUUAACUUCUCCAAC | M42: 21 | N42: 2 | O42: 0 | P42: 1 | Q42: 0 | R42: 3 | AC42: 6924 | AD42: 8 | AE42: 0 | AF42: 0
B43: ath-MIR164b | C43: reads | D43: UGGAGAAGCAGGGCACGUGCA | E43: 21 | F43: 1336 | G43: 1015 | H43: 1526 | I43: 2980 | J43: 6857 | L43: CAUGUGCCCAUCUUCACCAUC | M43: 21 | N43: 4 | O43: 5 | P43: 10 | Q43: 17 | R43: 36 | AC43: 6995 | AD43: 19 | AE43: 0 | AF43: 0
B44: ath-MIR164c | C44: reads | D44: UGGAGAAGCAGGGCACGUGCG | E44: 21 | F44: 37 | G44: 46 | H44: 229 | I44: 23 | J44: 335 | L44: CACGUGUUCUACUACUCCAAC | M44: 21 | N44: 9 | O44: 33 | P44: 34 | Q44: 16 | R44: 92 | AC44: 474 | AD44: 9 | AE44: 0 | AF44: 0 | AG44: =SUM(J43:J44) -> 7192 | AH44: =SUM(R42:R44) -> 131
A45: miR165/166 | B45: ath-MIR165a | C45: reads | D45: GGAAUGUUGUCUGGAUCGAGG | E45: 21 | F45: 48 | G45: 12 | H45: 143 | I45: 23 | J45: 226 | L45: UCGGACCAGGCUUCAUCCCCC | M45: 21 | N45: 211 | O45: 24 | P45: 191 | Q45: 88 | R45: 514 | AC45: 1026 | AD45: 17 | AE45: 0 | AF45: 0
B46: ath-MIR165b | C46: reads | D46: GGAAUGUUGUUUGGAUCGAGG | E46: 21 | F46: 9 | G46: 0 | H46: 4 | I46: 1 | J46: 14 | L46: UCGGACCAGGCUUCAUCCCCC | M46: 21 | N46: 211 | O46: 24 | P46: 191 | Q46: 88 | R46: 514 | AC46: 605 | AD46: 10 | AE46: 0 | AF46: 0 | AG46: =R46 -> 514 | AH46: =SUM(J45,J46) -> 240
A47: miR165/166 | B47: ath-MIR166a | C47: reads | D47: GGACUGUUGUCUGGCUCGAGG | E47: 21 | F47: 140 | G47: 13 | H47: 211 | I47: 77 | J47: 441 | L47: UCGGACCAGGCUUCAUUCCCC | M47: 21 | N47: 1216 | O47: 221 | P47: 1240 | Q47: 623 | R47: 3300 | AC47: 4441 | AD47: 19 | AE47: 0 | AF47: 0
B48: ath-MIR166b | C48: reads | D48: GGACUGUUGUCUGGCUCGAGG | E48: 21 | F48: 140 | G48: 13 | H48: 211 | I48: 77 | J48: 441 | L48: UCGGACCAGGCUUCAUUCCCC | M48: 21 | N48: 1216 | O48: 221 | P48: 1240 | Q48: 623 | R48: 3300 | AC48: 4412 | AD48: 20 | AE48: 0 | AF48: 0
B49: ath-MIR166c | C49: reads | D49: GGAUUGUUGUCUGGCUCGAGG | E49: 21 | F49: 0 | G49: 2 | H49: 0 | I49: 0 | J49: 2 | L49: UCGGACCAGGCUUCAUUCCCC | M49: 21 | N49: 1216 | O49: 221 | P49: 1240 | Q49: 623 | R49: 3300 | AC49: 3950 | AD49: 11 | AE49: 0 | AF49: 0
B50: ath-MIR166d | C50: reads | D50: GGAAUAUUGUCUGGCUCGAGG | E50: 21 | F50: 2 | G50: 0 | H50: 0 | I50: 0 | J50: 2 | L50: UCGGACCAGGCUUCAUUCCCC | M50: 21 | N50: 1216 | O50: 221 | P50: 1240 | Q50: 623 | R50: 3300 | AC50: 3954 | AD50: 13 | AE50: 0 | AF50: 0
B51: ath-MIR166e | C51: reads | D51: GGAAUGUUGUCUGGCACGAGG | E51: 21 | F51: 6 | G51: 33 | H51: 37 | I51: 28 | J51: 104 | L51: UCGGACCAGGCUUCAUUCCCC | M51: 21 | N51: 1216 | O51: 221 | P51: 1240 | Q51: 623 | R51: 3300 | AC51: 3877 | AD51: 19 | AE51: 0 | AF51: 0
B52: ath-MIR166f | C52: reads | D52: UGAAUGAUGCCUGGCUCGAGA | E52: 21 | F52: 4 | G52: 0 | H52: 0 | I52: 1 | J52: 5 | L52: UCGGACCAGGCUUCAUUCCCC | M52: 21 | N52: 1216 | O52: 221 | P52: 1240 | Q52: 623 | R52: 3300 | AC52: 3773 | AD52: 14 | AE52: 0 | AF52: 0
B53: ath-MIR166g | C53: reads | D53: GGAAUGUUGUUUGGCUCGAGG | E53: 21 | F53: 1 | G53: 0 | H53: 0 | I53: 5 | J53: 6 | L53: UCGGACCAGGCUUCAUUCCCC | M53: 21 | N53: 1216 | O53: 221 | P53: 1240 | Q53: 623 | R53: 3300 | AC53: 3768 | AD53: 12 | AE53: 0 | AF53: 0 | AG53: =R53 -> 3300 | AH53: =SUM(J48:J53) -> 560
A54: miR167 | B54: ath-MIR167a | C54: reads | D54: UGAAGCUGCCAGCAUGAUCUA | E54: 21 | F54: 2480 | G54: 14850 | H54: 6901 | I54: 11450 | J54: 35681 | L54: GAUCAUGUUCGCAGUUUCACC | M54: 21 | N54: 7 | O54: 6 | P54: 17 | Q54: 9 | R54: 39 | AC54: 36227 | AD54: 25 | AE54: 0 | AF54: 0
B55: ath-MIR167b | C55: reads | D55: UGAAGCUGCCAGCAUGAUCUA | E55: 21 | F55: 2480 | G55: 14850 | H55: 6901 | I55: 11450 | J55: 35681 | L55: GGUCAUGCUCUGACAGCCUCACU | M55: 23 | N55: 1 | O55: 0 | P55: 0 | Q55: 0 | R55: 1 | AC55: 36153 | AD55: 14 | AE55: 0 | AF55: 0
B56: ath-MIR167c | C56: reads | D56: UAAGCUGCCAGCAUGAUCUUG | E56: 21 | F56: 0 | G56: 10 | H56: 121 | I56: 7 | J56: 138 | L56: UAGGUCAUGCUGGUAGUUUCACC | M56: 23 | N56: 0 | O56: 1 | P56: 7 | Q56: 0 | R56: 8 | U56: UUAAGCUGCCAGCAUGAUCUU | V56: 21 | W56: 0 | X56: 2 | Y56: 1 | Z56: 0 | AA56: 3 | AB56: UAAGCUGCCAGCAUGAUCUUG | AC56: 196 | AD56: 19 | AE56: 0 | AF56: 0
B57: ath-MIR167d | C57: reads | D57: UGAAGCUGCCAGCAUGAUCUGG | E57: 22 | F57: 3 | G57: 22 | H57: 105 | I57: 144 | J57: 274 | L57: AGGUCAUCCUGCAGCUUCAGU | M57: 21 | N57: 3 | O57: 1 | P57: 1 | Q57: 4 | R57: 9 | AC57: 780 | AD57: 14 | AE57: 0 | AF57: 0 | AG57: =SUM(J55:J57) -> 36093 | AH57: =SUM(R54:R57) -> 57
A58: miR168 | B58: ath-MIR168a | C58: reads | D58: UCGCUUGGUGCAGGUCGGGAA | E58: 21 | F58: 163 | G58: 3364 | H58: 375 | I58: 1137 | J58: 5039 | L58: CCCGCCUUGCAUCAACUGAAU | M58: 21 | N58: 131 | O58: 1004 | P58: 370 | Q58: 407 | R58: 1912 | AC58: 7550 | AD58: 38 | AE58: 0 | AF58: 0
B59: ath-MIR168b | C59: reads | D59: UCGCUUGGUGCAGGUCGGGAA | E59: 21 | F59: 163 | G59: 3364 | H59: 375 | I59: 1137 | J59: 5039 | L59: CCCGUCUUGUAUCAACUGAAU | M59: 21 | N59: 1 | O59: 33 | P59: 9 | Q59: 20 | R59: 63 | AC59: 5465 | AD59: 16 | AE59: 0 | AF59: 0 | AG59: =J59 -> 5039 | AH59: =SUM(R58:R59) -> 1975
A60: miR169 | B60: ath-MIR169a | C60: reads | D60: CAGCCAAGGAUGACUUGCCGA | E60: 21 | F60: 25 | G60: 238 | H60: 596 | I60: 90 | J60: 949 | L60: GGCAAGUUGUCCUUGGCUAC | M60: 20 | N60: 43 | O60: 12 | P60: 401 | Q60: 6 | R60: 462 | AC60: 2126 | AD60: 27 | AE60: 0 | AF60: 0
B61: ath-MIR169b | C61: reads | D61: UGCAGCCAAGGAUGACUUGCC | E61: 21 | F61: 14 | G61: 6 | H61: 181 | I61: 0 | J61: 201 | L61: GGCAAGUUGUCCUUCGGCUACA | M61: 22 | N61: 5 | O61: 0 | P61: 62 | Q61: 0 | R61: 67 | AC61: 438 | AD61: 22 | AE61: 0 | AF61: 0
B62: ath-MIR169c | C62: reads | D62: CAGCCAAGGAUGACUUGCCGG | E62: 21 | F62: 3 | G62: 2 | H62: 43 | I62: 1 | J62: 49 | L62: none | AC62: 91 | AD62: 11 | AE62: 0 | AF62: 0
B63: ath-MIR169d | C63: reads | D63: UGAGCCAAGGAUGACUUGCCG | E63: 21 | F63: 139 | G63: 25 | H63: 196 | I63: 83 | J63: 443 | L63: GCAAGUUGACCUUGGCUCUGU | M63: 21 | N63: 3 | O63: 2 | P63: 4 | Q63: 9 | R63: 18 | AC63: 495 | AD63: 16 | AE63: 0 | AF63: 0
B64: ath-MIR169e | C64: reads | D64: UGAGCCAAGGAUGACUUGCCG | E64: 21 | F64: 139 | G64: 25 | H64: 196 | I64: 83 | J64: 443 | L64: GCAAGUUGACUUUGGCUCUGU | M64: 21 | N64: 0 | O64: 0 | P64: 14 | Q64: 0 | R64: 14 | AC64: 482 | AD64: 11 | AE64: 0 | AF64: 0
B65: ath-MIR169f | C65: reads | D65: UGAGCCAAGGAUGACUUGCCG | E65: 21 | F65: 139 | G65: 25 | H65: 196 | I65: 83 | J65: 443 | L65: GCAAGUUGACCUUGGCUCUGC | M65: 21 | N65: 3 | O65: 2 | P65: 193 | Q65: 2 | R65: 200 | AC65: 702 | AD65: 18 | AE65: 0 | AF65: 0
B66: ath-MIR169g | C66: reads | D66: UGAGCCAAGGAUGACUUGCCG | E66: 21 | F66: 139 | G66: 25 | H66: 196 | I66: 83 | J66: 443 | L66: GCAAGUUGACCUUGGCUCUGU | M66: 21 | N66: 3 | O66: 2 | P66: 4 | Q66: 9 | R66: 18 | AC66: 503 | AD66: 17 | AE66: 0 | AF66: 0
B67: ath-MIR169h | C67: reads | D67: UAGCCAAGGAUGACUUGCCUG | E67: 21 | F67: 101 | G67: 126 | H67: 388 | I67: 33 | J67: 648 | L67: GGCAGUCUCCUUGGCUAUUC | M67: 20 | N67: 0 | O67: 0 | P67: 3 | Q67: 0 | R67: 3 | AC67: 721 | AD67: 13 | AE67: 0 | AF67: 0
B68: ath-MIR169i | C68: reads | D68: UAGCCAAGGAUGACUUGCCUG | E68: 21 | F68: 101 | G68: 126 | H68: 388 | I68: 33 | J68: 648 | L68: GGCAGUCUCCUUGGCUAUC | M68: 19 | N68: 0 | O68: 0 | P68: 10 | Q68: 0 | R68: 10 | AC68: 854 | AD68: 17 | AE68: 0 | AF68: 0
B69: ath-MIR169j | C69: reads | D69: UAGCCAAGGAUGACUUGCCUG | E69: 21 | F69: 101 | G69: 126 | H69: 388 | I69: 33 | J69: 648 | L69: none | AC69: 799 | AD69: 15 | AE69: 0 | AF69: 0
B70: ath-MIR169k | C70: reads | D70: UAGCCAAGGAUGACUUGCCUG | E70: 21 | F70: 101 | G70: 126 | H70: 388 | I70: 33 | J70: 648 | L70: GGCAGUCUCCUUGGCUAUC | M70: 19 | N70: 0 | O70: 0 | P70: 10 | Q70: 0 | R70: 10 | AC70: 733 | AD70: 15 | AE70: 0 | AF70: 0
B71: ath-MIR169l | C71: reads | D71: UAGCCAAGGAUGACUUGCCUG | E71: 21 | F71: 101 | G71: 126 | H71: 388 | I71: 33 | J71: 648 | L71: GGCAGUCUCUUUGGCUAUC | M71: 19 | N71: 0 | O71: 0 | P71: 8 | Q71: 0 | R71: 8 | AC71: 794 | AD71: 12 | AE71: 0 | AF71: 0
B72: ath-MIR169m | C72: reads | D72: UAGCCAAGGAUGACUUGCCUG | E72: 21 | F72: 101 | G72: 126 | H72: 388 | I72: 33 | J72: 648 | L72: GGCAGUCUCCUUGGCUAUC | M72: 19 | N72: 0 | O72: 0 | P72: 10 | Q72: 0 | R72: 10 | AC72: 746 | AD72: 17 | AE72: 0 | AF72: 0
B73: ath-MIR169n | C73: reads | D73: UAGCCAAGGAUGACUUGCCUG | E73: 21 | F73: 101 | G73: 126 | H73: 388 | I73: 33 | J73: 648 | L73: none | AC73: 793 | AD73: 12 | AE73: 0 | AF73: 0 | AG73: =SUM(J60:J62, J66, J68) -> 2290 | AH73: =SUM(R60:R65, R67:R68,R71) -> 782
A74: miR170/miR171 | B74: ath-MIR170 | C74: reads | D74: UAUUGGCCUGGUUCACUCAGA | E74: 21 | F74: 14 | G74: 9 | H74: 14 | I74: 4 | J74: 41 | L74: UGAUUGAGCCGUGUCAAUAUC | M74: 21 | N74: 252 | O74: 279 | P74: 602 | Q74: 245 | R74: 1378 | AC74: 1425 | AD74: 7 | AE74: 0 | AF74: 0 | AG74: =R74 -> 1378 | AH74: =J74 -> 41
A75: miR170/miR171 | B75: ath-MIR171a | C75: reads | D75: UAUUGGCCUGGUUCACUCAGA | E75: 21 | F75: 14 | G75: 9 | H75: 14 | I75: 4 | J75: 41 | L75: UGAUUGAGCCGCGCCAAUAUC | M75: 21 | N75: 1813 | O75: 1556 | P75: 1878 | Q75: 2324 | R75: 7571 | AC75: 7692 | AD75: 16 | AE75: 0 | AF75: 0
B76: ath-MIR171b | C76: reads | D76: AGAUAUUAGUGCGGUUCAAUC | E76: 21 | F76: 14 | G76: 9 | H76: 13 | I76: 8 | J76: 44 | L76: UUGAGCCGUGCCAAUAUCACG | M76: 21 | N76: 82 | O76: 233 | P76: 63 | Q76: 108 | R76: 486 | AC76: 865 | AD76: 11 | AE76: 0 | AF76: 0
B77: ath-MIR171c | C77: reads | D77: AGAUAUUGGUGCGGUUCAAUC | E77: 21 | F77: 29 | G77: 43 | H77: 42 | I77: 66 | J77: 180 | L77: UUGAGCCGUGCCAAUAUCACG | M77: 21 | N77: 82 | O77: 233 | P77: 63 | Q77: 108 | R77: 486 | AC77: 1029 | AD77: 17 | AE77: 0 | AF77: 0 | AG77: =SUM(R75:R76) -> 8057 | AH77: =SUM(J75:J77) -> 265
A78: miR172 | B78: ath-MIR172a | C78: reads | D78: GUGGCAUCAUCAAGAUUCAC | E78: 20 | F78: 0 | G78: 2 | H78: 0 | I78: 2 | J78: 4 | L78: AGAAUCUUGAUGAUGCUGCAU | M78: 21 | N78: 841 | O78: 835 | P78: 266 | Q78: 2247 | R78: 4189 | AC78: 4383 | AD78: 17 | AE78: 1 | AF78: 1
B79: ath-MIR172b | C79: reads | D79: GCAGCACCAUUAAGAUUCAC | E79: 20 | F79: 376 | G79: 33 | H79: 28 | I79: 77 | J79: 514 | L79: AGAAUCUUGAUGAUGCUGCAU | M79: 21 | N79: 841 | O79: 835 | P79: 266 | Q79: 2247 | R79: 4189 | AC79: 5284 | AD79: 20 | AE79: 1 | AF79: 1
B80: ath-MIR172c | C80: reads | D80: GGAGCAUCAUCAAGAUUCACA | E80: 21 | F80: 8 | G80: 0 | H80: 0 | I80: 2 | J80: 10 | L80: AGAAUCUUGAUGAUGCUGCAG | M80: 21 | N80: 699 | O80: 18 | P80: 16 | Q80: 669 | R80: 1402 | AC80: 1560 | AD80: 16 | AE80: 0 | AF80: 0
B81: ath-MIR172d | C81: reads | D81: GCAACAUCUUCAAGAUUCAGA | E81: 21 | F81: 23 | G81: 1 | H81: 0 | I81: 22 | J81: 46 | L81: AGAAUCUUGAUGAUGCUGCAG | M81: 21 | N81: 699 | O81: 18 | P81: 16 | Q81: 669 | R81: 1402 | AC81: 1611 | AD81: 19 | AE81: 0 | AF81: 0
B82: ath-MIR172e | C82: reads | D82: GCAGCACCAUUAAGAUUCAC | E82: 20 | F82: 376 | G82: 33 | H82: 28 | I82: 77 | J82: 514 | L82: GGAAUCUUGAUGAUGCUGCAU | M82: 21 | N82: 172 | O82: 22 | P82: 143 | Q82: 169 | R82: 506 | AC82: 1412 | AD82: 19 | AE82: 8 | AF82: 3 | AG82: =SUM(R79:R80, R82) -> 6097 | AH82: =SUM(J78:J81) -> 574
A83: miR173 | B83: ath-MIR173 | C83: reads | D83: UUCGCUUGCAGAGAGAAAUCAC | E83: 22 | F83: 13 | G83: 15 | H83: 37 | I83: 35 | J83: 100 | L83: UGAUUCUCUGUGUAAGCGAAA | M83: 21 | N83: 3 | O83: 3 | P83: 30 | Q83: 22 | R83: 58 | AC83: 228 | AD83: 20 | AE83: 0 | AF83: 0 | AG83: =J83 -> 100 | AH83: =R83 -> 58
A84: miR159/319 | B84: ath-MIR319a | C84: reads | D84: AGCUUCCUUGAGUCCAUUCAC | E84: 21 | F84: 17 | G84: 0 | H84: 4 | I84: 1 | J84: 22 | L84: UUGGACUGAAGGGAGCUCCCU | M84: 21 | N84: 26 | O84: 9 | P84: 21 | Q84: 21 | R84: 77 | U84: UUGGACUGAAGGGAGCUCCC | V84: 20 | W84: 0 | X84: 0 | Y84: 0 | Z84: 0 | AA84: 0 | AB84: UUGGACUGAAGGGAGCUCCCU | AC84: 153 | AD84: 14 | AE84: 0 | AF84: 0
B85: ath-MIR319b | C85: reads | D85: AGAGCUUUCUUCGGUCCACUC | E85: 21 | F85: 13 | G85: 2 | H85: 14 | I85: 1 | J85: 30 | L85: UUGGACUGAAGGGAGCUCCCU | M85: 21 | N85: 26 | O85: 9 | P85: 21 | Q85: 21 | R85: 77 | U85: UUGGACUGAAGGGAGCUCCC | V85: 20 | W85: 0 | X85: 0 | Y85: 0 | Z85: 0 | AA85: 0 | AB85: UUGGACUGAAGGGAGCUCCCU | AC85: 136 | AD85: 15 | AE85: 0 | AF85: 0
B86: ath-MIR319cb | C86: reads | D86: GGAGAUUCUUUCAGUCCAGUC | E86: 21 | F86: 5 | G86: 4 | H86: 9 | I86: 2 | J86: 20 | L86: UUGGACUGAAGGGAGCUCCUU | M86: 21 | N86: 2 | O86: 0 | P86: 6 | Q86: 1 | R86: 9 | U86: UUGGACUGAAGGGAGCUCCU | V86: 20 | W86: 0 | X86: 0 | Y86: 1 | Z86: 0 | AA86: 1 | AB86: UUGGACUGAAGGGAGCUCCUU | AC86: 39 | AD86: 10 | AE86: 0 | AF86: 0 | AG86: =SUM(R84:R87) -> 575 | AH86: =SUM(J84:J87) -> 338
A87: miR390 | B87: ath-MIR390ab | C87: reads | D87: AGCUCAGGAGGGAUAGCGCC | E87: 20 | F87: 122 | G87: 24 | H87: 93 | I87: 27 | J87: 266 | L87: CGCUAUCCAUCCUGAGUUUCA | M87: 21 | N87: 142 | O87: 39 | P87: 127 | Q87: 104 | R87: 412 | U87: AAGCUCAGGAGGGAUAGCGCC | V87: 21 | W87: 63 | X87: 38 | Y87: 87 | Z87: 20 | AA87: 208 | AC87: 1144 | AD87: 25 | AE87: 0 | AF87: 0
B88: ath-MIR390b | C88: reads | D88: AGCUCAGGAGGGAUAGCGCC | E88: 20 | F88: 122 | G88: 24 | H88: 93 | I88: 27 | J88: 266 | L88: CGCUAUCCAUCCUGAGUUCC | M88: 20 | N88: 39 | O88: 10 | P88: 17 | Q88: 3 | R88: 69 | U88: AAGCUCAGGAGGGAUAGCGCC | V88: 21 | W88: 63 | X88: 38 | Y88: 87 | Z88: 20 | AA88: 208 | AC88: 685 | AD88: 26 | AE88: 0 | AF88: 0 | AG88: =J88 -> 266 | AH88: =SUM(R87:R88) -> 481
A89: miR393 | B89: ath-MIR393a | C89: reads | D89: UCCAAAGGGAUCGCAUUGAUCC | E89: 22 | F89: 0 | G89: 0 | H89: 4 | I89: 55 | J89: 59 | L89: none | U89: UCCAAAGGGAUCGCAUUGAUC | V89: 21 | W89: 0 | X89: 0 | Y89: 0 | Z89: 4 | AA89: 4 | AB89: UCCAAAGGGAUCGCAUUGAUCC | AC89: 68 | AD89: 6 | AE89: 0 | AF89: 0
B90: ath-MIR393b | C90: reads | D90: UCCAAAGGGAUCGCAUUGAUCC | E90: 22 | F90: 0 | G90: 0 | H90: 4 | I90: 55 | J90: 59 | L90: AUCAUGCGAUCUCUUUGGAUU | M90: 21 | N90: 0 | O90: 0 | P90: 1 | Q90: 3 | R90: 4 | U90: UCCAAAGGGAUCGCAUUGAUC | V90: 21 | W90: 0 | X90: 0 | Y90: 0 | Z90: 4 | AA90: 4 | AB90: UCCAAAGGGAUCGCAUUGAUCC | AC90: 72 | AD90: 7 | AE90: 0 | AF90: 0 | AG90: =J90 -> 59 | AH90: =R90 -> 4
A91: miR394 | B91: ath-MIR394a | C91: reads | D91: UUGGCAUUCUGUCCACCUCC | E91: 20 | F91: 35 | G91: 1 | H91: 10 | I91: 19 | J91: 65 | L91: AGGUGGGUAUACUGCCAAUAG | M91: 21 | N91: 8 | O91: 0 | P91: 1 | Q91: 3 | R91: 12 | AC91: 93 | AD91: 7 | AE91: 0 | AF91: 0
B92: ath-MIR394b | C92: reads | D92: UUGGCAUUCUGUCCACCUCC | E92: 20 | F92: 35 | G92: 1 | H92: 10 | I92: 19 | J92: 65 | L92: AGGUGGGCAUACUGCCAAUAG | M92: 21 | N92: 0 | O92: 0 | P92: 2 | Q92: 8 | R92: 10 | AC92: 93 | AD92: 6 | AE92: 0 | AF92: 0 | AG92: =J92 -> 65 | AH92: =SUM(R91:R92) -> 22
A93: miR395 | B93: ath-MIR395a | C93: reads | D93: none | L93: CUGAAGUGUUUGGGGGAACUC | M93: 21 | N93: 4 | O93: 0 | P93: 1 | Q93: 2 | R93: 7 | AC93: 11 | AD93: 3 | AE93: 0 | AF93: 0
B94: ath-MIR395b | C94: reads | D94: none | L94: CUGAAGUGUUUGGGGGGACUC | M94: 21 | N94: 3 | O94: 0 | P94: 3 | Q94: 0 | R94: 6 | AC94: 6 | AD94: 1 | AE94: 0 | AF94: 0
B95: ath-MIR395c | C95: reads | D95: none | L95: CUGAAGUGUUUGGGGGGACUC | M95: 21 | N95: 3 | O95: 0 | P95: 3 | Q95: 0 | R95: 6 | AC95: 6 | AD95: 1 | AE95: 0 | AF95: 0
B96: ath-MIR395d | C96: reads | D96: none | L96: CUGAAGUGUUUGGGGGAACUC | M96: 21 | N96: 4 | O96: 0 | P96: 1 | Q96: 2 | R96: 7 | AC96: 11 | AD96: 3 | AE96: 0 | AF96: 0
B97: ath-MIR395e | C97: reads | D97: none | L97: CUGAAGUGUUUGGGGGAACUC | M97: 21 | N97: 4 | O97: 0 | P97: 1 | Q97: 2 | R97: 7 | AC97: 11 | AD97: 3 | AE97: 0 | AF97: 0
B98: ath-MIR395f | C98: reads | D98: none | L98: CUGAAGUGUUUGGGGGGACUC | M98: 21 | N98: 3 | O98: 0 | P98: 3 | Q98: 0 | R98: 6 | AC98: 6 | AD98: 1 | AE98: 0 | AF98: 0 | AG98: =SUM(R97:R98) -> 13
A99: miR396 | B99: ath-MIR396ab | C99: reads | D99: UUCCACAGCUUUCUUGAACUG | E99: 21 | F99: 6 | G99: 4 | H99: 37 | I99: 13 | J99: 60 | L99: CGGUUCAAUAAAGCUGUGGGA | M99: 21 | N99: 16 | O99: 9 | P99: 82 | Q99: 21 | R99: 128 | AC99: 320 | AD99: 18 | AE99: 0 | AF99: 0
B100: ath-MIR396b | C100: reads | D100: UUCCACAGCUUUCUUGAACUU | E100: 21 | F100: 18 | G100: 23 | H100: 46 | I100: 90 | J100: 177 | L100: GCUCAAGAAAGCUGUGGGAAA | M100: 21 | N100: 2 | O100: 6 | P100: 3 | Q100: 13 | R100: 24 | AC100: 237 | AD100: 14 | AE100: 0 | AF100: 0 | AG100: =SUM(J99:J100) -> 237 | AH100: =SUM(R99:R100) -> 152
A101: miR397 | B101: ath-MIR397a | C101: reads | D101: UCAUUGAGUGCAGCGUUGAUG | E101: 21 | F101: 7 | G101: 27 | H101: 2 | I101: 74 | J101: 110 | L101: none | AC101: 150 | AD101: 4 | AE101: 0 | AF101: 0
B102: ath-MIR397b | C102: reads | D102: UCAUUGAGUGCAUCGUUGAUG | E102: 21 | F102: 5 | G102: 107 | H102: 29 | I102: 110 | J102: 251 | L102: none | AC102: 252 | AD102: 2 | AE102: 0 | AF102: 0 | AG102: =SUM(J101:J102) -> 361
A103: miR398 | B103: ath-MIR398a | C103: reads | D103: GGAGUGGCAUGUGAACACAUA | E103: 21 | F103: 2 | G103: 4 | H103: 115 | I103: 0 | J103: 121 | L103: UGUGUUCUCAGGUCACCCCU | M103: 20 | N103: 1 | O103: 41 | P103: 14 | Q103: 17 | R103: 73 | AC103: 237 | AD103: 13 | AE103: 0 | AF103: 0
B104: ath-MIR398b | C104: reads | D104: GGGUUGAUAUGAGAACACACG | E104: 21 | F104: 13 | G104: 7 | H104: 64 | I104: 38 | J104: 122 | L104: UGUGUUCUCAGGUCACCCCUG | M104: 21 | N104: 40 | O104: 2267 | P104: 230 | Q104: 1395 | R104: 3932 | AC104: 4189 | AD104: 18 | AE104: 0 | AF104: 0
B105: ath-MIR398c | C105: reads | D105: GGGUUGAUAUGAGAACACACG | E105: 21 | F105: 13 | G105: 7 | H105: 64 | I105: 38 | J105: 122 | L105: UGUGUUCUCAGGUCACCCCUG | M105: 21 | N105: 40 | O105: 2267 | P105: 230 | Q105: 1395 | R105: 3932 | AC105: 4191 | AD105: 19 | AE105: 0 | AF105: 0 | AG105: =SUM(R103:R104) -> 4005
A106: miR399 | B106: ath-MIR399a | C106: reads | D106: none | L106: UGCCAAAGGAGAUUUGCCCUG | M106: 21 | N106: 32 | O106: 1 | P106: 28 | Q106: 18 | R106: 79 | AC106: 82 | AD106: 2 | AE106: 0 | AF106: 0
B107: ath-MIR399b | C107: reads | D107: UCUCCAUUGGCAGGUCCU | E107: 18 | F107: 0 | G107: 2 | H107: 0 | I107: 0 | J107: 2 | L107: UGCCAAAGGAGAGUUGCCCUG | M107: 21 | N107: 231 | O107: 27 | P107: 116 | Q107: 86 | R107: 460 | AC107: 512 | AD107: 9 | AE107: 0 | AF107: 0
B108: ath-MIR399c | C108: reads | D108: GGGCAUCUUUCUAUUGGCAGG | E108: 21 | F108: 44 | G108: 1 | H108: 30 | I108: 61 | J108: 136 | L108: UGCCAAAGGAGAGUUGCCCUG | M108: 21 | N108: 231 | O108: 27 | P108: 116 | Q108: 86 | R108: 460 | AC108: 605 | AD108: 10 | AE108: 0 | AF108: 0
B109: ath-MIR399d | C109: reads | D109: none | L109: UGCCAAAGGAGAUUUGCCCCG | M109: 21 | N109: 5 | O109: 0 | P109: 0 | Q109: 3 | R109: 8 | AC109: 10 | AD109: 3 | AE109: 0 | AF109: 0
B110: ath-MIR399ee | D110: none | L110: none
B111: ath-MIR399f | C111: reads | D111: GGGCAAGAUCACCAUUGGCAGA | E111: 22 | F111: 0 | G111: 0 | H111: 1 | I111: 0 | J111: 1 | L111: UGCCAAAGGAGAUUUGCCCGG | M111: 21 | N111: 9 | O111: 3 | P111: 8 | Q111: 13 | R111: 33 | AC111: 37 | AD111: 4 | AE111: 0 | AF111: 0 | AG111: =SUM(R106:R107, R109, R111) -> 580 | AH111: =SUM(J107:J108, J111) -> 139
A112: miR400 | B112: ath-MIR400 | C112: reads | D112: UAUGAGAGUAUUAUAAGUCAC | E112: 21 | F112: 4 | G112: 15 | H112: 107 | I112: 9 | J112: 135 | L112: AGUGACUUAUGAUAAUCUCAU | M112: 21 | N112: 0 | O112: 0 | P112: 2 | Q112: 0 | R112: 2 | AC112: 143 | AD112: 7 | AE112: 0 | AF112: 0 | AG112: =J112 -> 135 | AH112: =R112 -> 2
A113: miR401d | B113: ath-MIR401 | C113: reads | D113: UUGCUGGGCCGAAACUGGUGUCG | E113: 23 | F113: 0 | G113: 0 | H113: 1 | I113: 0 | J113: 1 | L113: CCUUAUCUCCAUUGUUGUCC | M113: 20 | N113: 1 | O113: 0 | P113: 0 | Q113: 0 | R113: 1 | U113: CGAAACUGGUGUCGACCGACA | V113: 21 | W113: 0 | X113: 0 | Y113: 0 | Z113: 0 | AA113: 0 | AC113: 6 | AD113: 6 | AE113: 5 | AF113: 4
A114: miR402 | B114: ath-MIR402 | C114: reads | D114: UUCGAGGCCUAUUAAACCUCUG | E114: 22 | F114: 3 | G114: 0 | H114: 5 | I114: 3 | J114: 11 | L114: UAGGGGUUUAUAGACCUCGAA | M114: 21 | N114: 0 | O114: 0 | P114: 3 | Q114: 0 | R114: 3 | AC114: 22 | AD114: 6 | AE114: 0 | AF114: 0
A115: miR403c | B115: ath-MIR403 | C115: reads | D115: UGUUUUGUGCUUGAAUCUAAUU | E115: 22 | F115: 16 | G115: 1070 | H115: 96 | I115: 461 | J115: 1643 | L115: UUAGAUUCACGCACAAACUCG | M115: 21 | N115: 17 | O115: 9 | P115: 25 | Q115: 15 | R115: 66 | AC115: 1774 | AD115: 13 | AE115: 0 | AF115: 0 | AG115: =R115 -> 66 | AH115: =J115 -> 1643
A116: miR404e | B116: ath-MIR404 | D116: none | L116: none | U116: AUUAACGCUGGCGGUUGCGGCAGC | V116: =LEN(U116) -> 24 | W116: 0 | X116: 0 | Y116: 0 | Z116: 0 | AA116: 0
A117: miR405d | B117: ath-MIR405a | C117: reads | D117: GGUUGACCCAACUCAUUUUGUUA | E117: 23 | F117: 0 | G117: 0 | H117: 0 | I117: 3 | J117: 3 | L117: GAUGGGUUGAGUUGUUAAAUGGGU | M117: 24 | N117: 2 | O117: 4 | P117: 3 | Q117: 3 | R117: 12 | U117: AUGAGUUGGGUCUAACCCAUAACU | V117: 24 | W117: 0 | X117: 0 | Y117: 0 | Z117: 0 | AA117: 0 | AC117: 57 | AD117: 21 | AE117: 20 | AF117: 13
B118: ath-MIR405b | C118: reads | D118: UCAUUUAACAAAAUGAGUUGGGUC | E118: 24 | F118: 0 | G118: 0 | H118: 0 | I118: 1 | J118: 1 | L118: none | U118: AUGAGUUGGGUCUAACCCAUAACU | V118: 24 | W118: 0 | X118: 0 | Y118: 0 | Z118: 0 | AA118: 0 | AC118: 1 | AD118: 1 | AE118: 13 | AF118: 6
B119: ath-MIR405d | C119: reads | D119: GGUUGACCCAACUCAUUUUGUUA | E119: 23 | F119: 0 | G119: 0 | H119: 0 | I119: 3 | J119: 3 | L119: none | U119: AUGAGUUGGGUCUAACCCAUAACU | V119: 24 | W119: 0 | X119: 0 | Y119: 0 | Z119: 0 | AA119: 0 | AC119: 4 | AD119: 2 | AE119: 15 | AF119: 5
A120: miR406d | B120: ath-MIR406 | C120: reads | D120: none | L120: UAAUCCAGAAUCCGAAAGAAACGA | M120: 24 | N120: 0 | O120: 0 | P120: 0 | Q120: 2 | R120: 2 | U120: UAGAAUGCUAUUGUAAUCCAG | V120: 21 | W120: 0 | X120: 0 | Y120: 0 | Z120: 0 | AA120: 0 | AC120: 2 | AD120: 1 | AE120: 1 | AF120: 1
A121: miR407d | B121: ath-MIR407 | C121: reads | D121: UCGCCAACUUUUAAAAAUGGGAC | E121: 23 | F121: 0 | G121: 2 | H121: 0 | I121: 1 | J121: 3 | L121: AAAACGACAUUUCAGGAGUUGGUG | M121: 24 | N121: 1 | O121: 0 | P121: 0 | Q121: 0 | R121: 1 | U121: UUUAAAUCAUAUACUUUUGGU | V121: 21 | W121: 0 | X121: 0 | Y121: 0 | Z121: 0 | AA121: 0 | AC121: 17 | AD121: 13 | AE121: 10 | AF121: 9
A122: miR408 | B122: ath-MIR408 | C122: reads | D122: ACAGGGAACAAGCAGAGCAUG | E122: 21 | F122: 6 | G122: 0 | H122: 18 | I122: 14 | J122: 38 | L122: AUGCACUGCCUCUUCCCUGGC | M122: 21 | N122: 25 | O122: 342 | P122: 12 | Q122: 117 | R122: 496 | AC122: 913 | AD122: 20 | AE122: 0 | AF122: 0 | AG122: =R122 -> 496 | AH122: =J122 -> 38
A123: miR413e | B123: ath-MIR413 | D123: none | L123: none | U123: AUAGUUUCUCUUGUUCUGCAC | V123: =LEN(U123) -> 21 | W123: 0 | X123: 0 | Y123: 0 | Z123: 0 | AA123: 0
A124: miR414e | B124: ath-MIR414 | D124: none | L124: none | U124: UCAUCUUCAUCAUCAUCGUCA | V124: =LEN(U124) -> 21 | W124: 0 | X124: 0 | Y124: 0 | Z124: 0 | AA124: 0
A125: miR415e | B125: ath-MIR415 | D125: none | L125: none | U125: AACAGAGCAGAAACAGAACAU | V125: =LEN(U125) -> 21 | W125: 0 | X125: 0 | Y125: 0 | Z125: 0 | AA125: 0
A126: miR416e | B126: ath-MIR416 | C126: reads | D126: UGAACCCGGUUUGUACGUAUGGAC | E126: 24 | F126: 0 | G126: 0 | H126: 1 | I126: 0 | J126: 1 | L126: none | U126: GGUUCGUACGUACACUGUUCA | V126: 21 | W126: 0 | X126: 0 | Y126: 0 | Z126: 0 | AA126: 0 | AC126: 1 | AD126: 1 | AE126: 2 | AF126: 1
A127: miR417e | B127: ath-MIR417 | D127: none | L127: none | U127: GAAGGUAGUGAAUUUGUUCGA | V127: =LEN(U127) -> 21 | W127: 0 | X127: 0 | Y127: 0 | Z127: 0 | AA127: 0
A128: miR418e | B128: ath-MIR418 | D128: none | L128: none | U128: UAAUGUGAUGAUGAACUGACC | V128: =LEN(U128) -> 21 | W128: 0 | X128: 0 | Y128: 0 | Z128: 0 | AA128: 0
A129: miR419e | B129: ath-MIR419 | D129: none | L129: none | U129: UUAUGAAUGCUGAGGAUGUUG | V129: =LEN(U129) -> 21 | W129: 0 | X129: 0 | Y129: 0 | Z129: 0 | AA129: 0
A130: miR420e | B130: ath-MIR420 | D130: none | L130: none | U130: UAAACUAAUCACGGAAAUGCA | V130: =LEN(U130) -> 21 | W130: 0 | X130: 0 | Y130: 0 | Z130: 0 | AA130: 0
A131: miR426e | B131: ath-MIR426 | D131: none | L131: none | U131: UUUUGGAAAUUUGUCCUUACG | V131: =LEN(U131) -> 21 | W131: 0 | X131: 0 | Y131: 0 | Z131: 0 | AA131: 0
A132: miR447 | B132: ath-MIR447a | C132: reads | D132: ACCCCUUACAAUGUCGAGUAA | E132: 21 | F132: 0 | G132: 0 | H132: 6 | I132: 1 | J132: 7 | L132: UGGGGACGAGAUGUUUUGUUG | M132: 21 | N132: 7 | O132: 1 | P132: 19 | Q132: 2 | R132: 29 | U132: UUGGGGACGAGAUGUUUUGUUG | V132: 22 | W132: 8 | X132: 1 | Y132: 6 | Z132: 2 | AA132: 17 | AC132: 92 | AD132: 16 | AE132: 0 | AF132: 0
B133: ath-MIR447b | C133: reads | D133: UCCCCUUACAAUGUCGAGUAA | E133: 21 | F133: 11 | G133: 1 | H133: 0 | I133: 1 | J133: 13 | L133: UGGGGACGAGAUGUUUUGUUG | M133: 21 | N133: 7 | O133: 1 | P133: 19 | Q133: 2 | R133: 29 | U133: UUGGGGACGAGAUGUUUUGUUG | V133: 22 | W133: 8 | X133: 1 | Y133: 6 | Z133: 2 | AA133: 17 | AC133: 100 | AD133: 17 | AE133: 0 | AF133: 0
B134: ath-MIR447c | C134: reads | D134: CCCCUUACAAUGUCGAGUA | E134: 19 | F134: 5 | G134: 0 | H134: 0 | I134: 0 | J134: 5 | L134: none | AC134: 7 | AD134: 3 | AE134: 0 | AF134: 0 | AG134: =R132 -> 29 | AH134: =SUM(J132:J134) -> 25
B136: a A proposed revised sequence for the miRNA based on a higher read frequency for a variant of the annotated sequence
B137: b The miRNA* sequence was more abundant in the dataset than the annotated miRNA sequence for MIR319c, MIR390a, and MIR396a
B138: c The miRNA* sequence was much more abundant in the dataset than the annotated miRNA sequence for MIR403
B139: d The MIR401 and MIR405 loci appeared to be repetitive elements in our analysis, given the extensive set of unique non-overlapping reads which map to them, and the number of times these reads hit elsewhere in the genome. Small RNA sequences hitting MIR401 and MIR405 also matched Athila retroelement and Simplehat transposon repeats, respectively. MIR406 and MIR407 may also have been misannotated as miRNA loci, as suggested by the propensity for antisense reads to occur as often as sense reads at these loci.
B140: e Although we isolated small RNAs corresponding to all previously annotated and experimentally verified mature miRNA sequences, and almost all family variants except miR159c, and the annotated miR319a and miR319b, we did not sequence any representative small RNAs from MIR404. Nor did we sequence any reads that map to hairpins for the computationally predicted MIR413 through MIR420, or for MIR426, except for two unique non-miRNA reads on the MIR416 foldback (with read frequencies of one and two). Therefore, miR413 through miR420, miR404 and miR426 are either induced exclusively under very specific conditions, or they may represent non-miRNA loci.

A1: Most abundant sequence on 5' arm

A1: Most abundant sequence on 3' arm